{
  "name": "architecture",
  "version": "1.0.0",
  "description": "The project's defined architecture (doc + folder plan), an architect assistant, and a note that makes each tab's agent follow it",
  "owner": "nexo",
  "dependsOn": ["projects", "sessions", "editor"],
  "entry": { "server": "server/index.ts", "web": "web/index.tsx" }
}
