{
  "name": "docs",
  "version": "1.1.0",
  "description": "The agent-os-nexo documentation in the app, in its language: opened from Settings, with a cover, a grouped index, full-text search and a reader with an outline",
  "owner": "nexo",
  "dependsOn": ["shell"],
  "entry": { "server": "server/index.ts", "web": "web/index.tsx" }
}
