{
  "name": "modules",
  "version": "1.0.0",
  "description": "Module manager: turn modules on and off, respecting their dependencies",
  "owner": "nexo",
  "core": true,
  "dependsOn": [
    "shell"
  ],
  "entry": {
    "web": "web/index.tsx"
  },
  "nav": {
    "label": "Modules",
    "icon": "blocks",
    "order": 95
  }
}
